{
  "allowlist": [
    { "chainId": 8453, "to": "0xe592427a0aece92de3edee1f18e0157c05861564", "selector": "0x04e45aaf" }
  ],
  "caps": {
    "max_outflow_h1": { "BASE_USDC": "100000000" },
    "max_outflow_d1": { "BASE_USDC": "300000000" },
    "max_per_function_h1": 60,
    "per_target": {
      "h1": { "0xe592427a0aece92de3edee1f18e0157c05861564|0x04e45aaf": { "BASE_USDC": "50000000" } }
    }
  },
  "pause": false,
  "meta": {
    "schemaVersion": "v0.3",
    "denominations": {
      "BASE_USDC": { "decimals": 6, "chainId": 8453 }
    },
    "defaultDenomination": "BASE_USDC",
    "nonce_max_gap": 1,
    "slippage_max_bps": 50
  }
}
